{
  "complete_count": 42,
  "engine": {
    "backend": "hybrid-engine",
    "effort": "high",
    "execution": "sequential docker compose containers",
    "formula": true,
    "image_analysis": true,
    "mode": "auto",
    "name": "MinerU",
    "table": true,
    "version": "3.4.4"
  },
  "failed_count": 0,
  "generated_at_utc": "2026-07-21T00:06:31.958986+00:00",
  "generator": "scripts/run_mineru_manifest.py",
  "manifest_relpath": "data/external/sources.toml",
  "manifest_sha256": "3b300f6ce411fd4cf14d9fc6d19c9d8b6d6985a3c58eb73953ccda811302b1a9",
  "schema_version": 1,
  "source_count": 42,
  "sources": [
    {
      "outputs": [
        {
          "relpath": "build/document_ocr/mineru_corpus/SUPERFORCE---S.C.Pais---2023/hybrid_auto/SUPERFORCE---S.C.Pais---2023_content_list.json",
          "role": "content_list",
          "sha256": "c092e67881fd224d371c07da084a5d147a4fce4c2e14c3d5ad7a5ae9cd85c829",
          "size_bytes": 18945
        },
        {
          "relpath": "build/document_ocr/mineru_corpus/SUPERFORCE---S.C.Pais---2023/hybrid_auto/SUPERFORCE---S.C.Pais---2023_content_list_v2.json",
          "role": "content_list_v2",
          "sha256": "833b9df6da62cf9889c974678c0ec3854ec6f019fdf740cc00bb1a2301fa3b99",
          "size_bytes": 40223
        },
        {
          "relpath": "build/document_ocr/mineru_corpus/SUPERFORCE---S.C.Pais---2023/hybrid_auto/SUPERFORCE---S.C.Pais---2023_layout.pdf",
          "role": "layout_pdf",
          "sha256": "383c8560b4d3fc5731157818cdf836c5343bd8b51e9635d2b65206634e9f9de8",
          "size_bytes": 338449
        },
        {
          "relpath": "build/document_ocr/mineru_corpus/SUPERFORCE---S.C.Pais---2023/hybrid_auto/SUPERFORCE---S.C.Pais---2023.md",
          "role": "markdown",
          "sha256": "11e12860a49188a2321caadc69f1beaf4c2dae53a2f5e342712bdeba9cd9ca1d",
          "size_bytes": 11143
        },
        {
          "relpath": "build/document_ocr/mineru_corpus/SUPERFORCE---S.C.Pais---2023/hybrid_auto/SUPERFORCE---S.C.Pais---2023_middle.json",
          "role": "middle",
          "sha256": "a90ea170aac7257afc4dfebd4f3ba7a9c5da211e282c02b7b9f2699258f7ab6c",
          "size_bytes": 298050
        },
        {
          "relpath": "build/document_ocr/mineru_corpus/SUPERFORCE---S.C.Pais---2023/hybrid_auto/SUPERFORCE---S.C.Pais---2023_model.json",
          "role": "model",
          "sha256": "996f36cd27a25ccee0bc564c714bdd196243309218ceef5c67f051e02cf38d68",
          "size_bytes": 55710
        },
        {
          "relpath": "build/document_ocr/mineru_corpus/SUPERFORCE---S.C.Pais---2023/hybrid_auto/SUPERFORCE---S.C.Pais---2023_origin.pdf",
          "role": "origin_pdf",
          "sha256": "40f25d9a7b3db0a4689f3ea2d66f8d0c6896af5ed99fb4f10a749340d1de7ae5",
          "size_bytes": 234350
        }
      ],
      "source_id": "pais_superforce_2023",
      "source_relpath": "source_materials/pdfs/SUPERFORCE---S.C.Pais---2023.pdf",
      "source_sha256": "8ea4fecbd504b2dfa73941f856befe5bee23b1ebffa8a6a8bbd19e185a675176",
      "source_size_bytes": 238900,
      "status": "complete"
    },
    {
      "outputs": [
        {
          "relpath": "build/document_ocr/mineru_corpus/Comment_on_the_Pais_Superforce_Theory/hybrid_auto/Comment_on_the_Pais_Superforce_Theory_content_list.json",
          "role": "content_list",
          "sha256": "64512aec7d69925f38895b9bf55b50acb51d7089a2d042dd116935ae6ead5556",
          "size_bytes": 16911
        },
        {
          "relpath": "build/document_ocr/mineru_corpus/Comment_on_the_Pais_Superforce_Theory/hybrid_auto/Comment_on_the_Pais_Superforce_Theory_content_list_v2.json",
          "role": "content_list_v2",
          "sha256": "33b9ca55a1c3991da205e4734763fddf0dd710b279f37bb87b0f55e6cba92278",
          "size_bytes": 32636
        },
        {
          "relpath": "build/document_ocr/mineru_corpus/Comment_on_the_Pais_Superforce_Theory/hybrid_auto/Comment_on_the_Pais_Superforce_Theory_layout.pdf",
          "role": "layout_pdf",
          "sha256": "5ac908dbd54d6af6f70341e84a35dd02ef19728f2bf7048d7d9320f2b05b5199",
          "size_bytes": 3022219
        },
        {
          "relpath": "build/document_ocr/mineru_corpus/Comment_on_the_Pais_Superforce_Theory/hybrid_auto/Comment_on_the_Pais_Superforce_Theory.md",
          "role": "markdown",
          "sha256": "42f14c2314dea6fae6df9556645be2f246d6d49e513df72d66292955ce45391e",
          "size_bytes": 5785
        },
        {
          "relpath": "build/document_ocr/mineru_corpus/Comment_on_the_Pais_Superforce_Theory/hybrid_auto/Comment_on_the_Pais_Superforce_Theory_middle.json",
          "role": "middle",
          "sha256": "4f9c07afecbcc1d2a4afb7508b8037880fbcef7fd92cbd5e88ee3d20959895f2",
          "size_bytes": 241181
        },
        {
          "relpath": "build/document_ocr/mineru_corpus/Comment_on_the_Pais_Superforce_Theory/hybrid_auto/Comment_on_the_Pais_Superforce_Theory_model.json",
          "role": "model",
          "sha256": "3fc63e4af83c9d83bcc29fb517e2f3d2e837db1c689613666c8d717cce3caaac",
          "size_bytes": 37854
        },
        {
          "relpath": "build/document_ocr/mineru_corpus/Comment_on_the_Pais_Superforce_Theory/hybrid_auto/Comment_on_the_Pais_Superforce_Theory_origin.pdf",
          "role": "origin_pdf",
          "sha256": "f1b4af39cfb7f0a4526fe62ffa13879bbac453575f06a0e831ee9d9b4afda84e",
          "size_bytes": 2973039
        }
      ],
      "source_id": "brandenburg_comment_superforce",
      "source_relpath": "source_materials/pdfs/Comment_on_the_Pais_Superforce_Theory.pdf",
      "source_sha256": "ca32b85da9dc732509ea4560184c160e2e503f56bea861c7a05542040f9e9b75",
      "source_size_bytes": 2975994,
      "status": "complete"
    },
    {
      "outputs": [
        {
          "relpath": "build/document_ocr/mineru_corpus/Phys-140A-lecture-14v3/hybrid_auto/Phys-140A-lecture-14v3_content_list.json",
          "role": "content_list",
          "sha256": "146036f61befaf01d77616e6895e8ade59b789b35b8688cbe3cfda342c1bf199",
          "size_bytes": 35934
        },
        {
          "relpath": "build/document_ocr/mineru_corpus/Phys-140A-lecture-14v3/hybrid_auto/Phys-140A-lecture-14v3_content_list_v2.json",
          "role": "content_list_v2",
          "sha256": "c82d9c06a61e3f279ad226217c18aab86455c45c60cab7ce4af509047b6b81d6",
          "size_bytes": 65947
        },
        {
          "relpath": "build/document_ocr/mineru_corpus/Phys-140A-lecture-14v3/hybrid_auto/Phys-140A-lecture-14v3_layout.pdf",
          "role": "layout_pdf",
          "sha256": "c23e336b6bd138e3e39f15a425371997a88d6494fbd652953e13fd87f05ac287",
          "size_bytes": 685904
        },
        {
          "relpath": "build/document_ocr/mineru_corpus/Phys-140A-lecture-14v3/hybrid_auto/Phys-140A-lecture-14v3.md",
          "role": "markdown",
          "sha256": "2f7668d06014e6c0776ae131224e46528cb243148af61ffe0f4134cbccc4b5a4",
          "size_bytes": 19254
        },
        {
          "relpath": "build/document_ocr/mineru_corpus/Phys-140A-lecture-14v3/hybrid_auto/Phys-140A-lecture-14v3_middle.json",
          "role": "middle",
          "sha256": "19d4218ad45b60d78608c4442dcad1b87279c5f7d9a878c1fb4dd22df79c31f3",
          "size_bytes": 499101
        },
        {
          "relpath": "build/document_ocr/mineru_corpus/Phys-140A-lecture-14v3/hybrid_auto/Phys-140A-lecture-14v3_model.json",
          "role": "model",
          "sha256": "bf66bdee1267c397b4d460012b04e5031ab8f94a0cd0fb22038d872f26dddd9e",
          "size_bytes": 84757
        },
        {
          "relpath": "build/document_ocr/mineru_corpus/Phys-140A-lecture-14v3/hybrid_auto/Phys-140A-lecture-14v3_origin.pdf",
          "role": "origin_pdf",
          "sha256": "07b9698c5146f595ba959dab0aef99db4537a6f8d58cd46b8091e885443c2110",
          "size_bytes": 553470
        }
      ],
      "source_id": "phys_140a_lecture_14v3",
      "source_relpath": "source_materials/pdfs/Phys-140A-lecture-14v3.pdf",
      "source_sha256": "3f789aedd14872d1a56c24ce62f293dac7dc6e3a6bcaa9f60b18afaf5684c859",
      "source_size_bytes": 562639,
      "status": "complete"
    },
    {
      "outputs": [
        {
          "relpath": "build/document_ocr/mineru_corpus/1111.4064v2/hybrid_auto/1111.4064v2_content_list.json",
          "role": "content_list",
          "sha256": "7b747900df635630cf2a66a9905f26419374f8b337aba6b17825202abb6dbed4",
          "size_bytes": 48446
        },
        {
          "relpath": "build/document_ocr/mineru_corpus/1111.4064v2/hybrid_auto/1111.4064v2_content_list_v2.json",
          "role": "content_list_v2",
          "sha256": "2b80959bc7faf5af09b5bd1caa3381e9700bfaa1b1e3cdc05ed34a4ade8b5025",
          "size_bytes": 118808
        },
        {
          "relpath": "build/document_ocr/mineru_corpus/1111.4064v2/hybrid_auto/1111.4064v2_layout.pdf",
          "role": "layout_pdf",
          "sha256": "62a5bf7e9f5694a67c986825fe748cc5ae9f32c9010437e0dff3a568b1cc00cf",
          "size_bytes": 831322
        },
        {
          "relpath": "build/document_ocr/mineru_corpus/1111.4064v2/hybrid_auto/1111.4064v2.md",
          "role": "markdown",
          "sha256": "ccd8d2586b1694d27177e5354e1a9d4d05d2510e681592e39f818814faece657",
          "size_bytes": 31657
        },
        {
          "relpath": "build/document_ocr/mineru_corpus/1111.4064v2/hybrid_auto/1111.4064v2_middle.json",
          "role": "middle",
          "sha256": "47941a7a35e2e2d509794c1811ba3cee1514e6c9f20452956e6df763840589fe",
          "size_bytes": 975664
        },
        {
          "relpath": "build/document_ocr/mineru_corpus/1111.4064v2/hybrid_auto/1111.4064v2_model.json",
          "role": "model",
          "sha256": "0daac988a0ce893f395076b3b58d978f426047704aed1e3098f880a1f93d18cd",
          "size_bytes": 184004
        },
        {
          "relpath": "build/document_ocr/mineru_corpus/1111.4064v2/hybrid_auto/1111.4064v2_origin.pdf",
          "role": "origin_pdf",